{
	"$schema": "../schemas/business-testing.schema.json",
	"schemaVersion": 1,
	"name": "stackwarden-business-testing",
	"sourceOfTruth": "packages/stackwarden/config/business-testing.json",
	"methodologySource": "stackwarden://business-testing",
	"generatedDocument": "packages/stackwarden/docs/business-testing.md",
	"purpose": "Transform StackWarden business intent into executable, verifiable, and traceable tests for CLI, rule, configuration, hook, and check behavior.",
	"principles": [
		"GitHub issues carry business intent and traceability.",
		"Gherkin is a shared business language, not a UI or API script.",
		"Business-unit tests prove domain rules in isolation.",
		"Acceptance tests prove critical system behavior.",
		"Config files with source-of-truth status must declare a schema and pass schema drift checks."
	],
	"traceability": [
		{
			"businessIntent": "#39 governance CLI",
			"feature": "features/governance-audit.feature",
			"executableTest": "src/business-acceptance.test.js"
		},
		{
			"businessIntent": "#42 stable JSON findings",
			"feature": "features/governance-audit.feature",
			"executableTest": "velocity finding assertions"
		},
		{
			"businessIntent": "#43 deterministic rule catalog",
			"feature": "features/governance-audit.feature",
			"executableTest": "ownership and feedback-loop assertions"
		},
		{
			"businessIntent": "#48 fixtures and dogfooding",
			"feature": "features/governance-audit.feature",
			"executableTest": "temporary repository fixtures"
		},
		{
			"businessIntent": "#60 generated open-core model",
			"feature": "features/governance-audit.feature",
			"executableTest": "docs:open-core:check and premium masking assertions"
		}
	],
	"rules": [
		"Gherkin describes business behavior, not implementation details.",
		"Acceptance tests assert deterministic outputs: finding ids, levels, evidence, recommendations, capabilities visibility, and config-controlled blocking.",
		"Client-safe behavior is tested as a business invariant: init is dry-run first, writes only under .stackwarden/ with --write, and skips existing files.",
		"Open-core behavior is tested: emitted core findings are implemented and fully visible; premium logic is not exposed.",
		"Executable checks are tested as advisory by default, with blocking controlled by config or explicit strict mode.",
		"Config source-of-truth files are invalid unless a schema is attached and the schema-required fields match the config.",
		"Lean/5S and business-testing signals are tested in deep mode because they require broader repository context."
	]
}
